{"case":"model-delegate-replacement","finished_at":"2026-09-20T02:13:02.334142Z","limitations":["synthetic-loopback-models; no real accounts"],"results":[{"artifact_directory":"/tmp/agentcfg-pi-volume-o7nluwv_/cold-pi-default-484f07e9/first/home/tmp/agentcfg-native-rztt6kcg/cases/delegate-presets","execution":{"exit_code":0,"termination_confirmed":true},"facts":{"activity_drained":true,"delegate_runs":7,"manager_limit":2,"presets_verified":["general","context","challenge","plan","research","review","scout"],"real_account_used":false,"roles":["reviewer","scout"],"sdk_session":true,"source_preserved":true,"tools":["Agent","bash","edit","editor","find","get_subagent_result","grep","ls","model_delegate","read","rename","steer_subagent","todo","write"],"transport":"direct","verified_execution_only":true},"scenario_id":"delegate-presets","status":"passed"},{"artifact_directory":"/tmp/agentcfg-pi-volume-o7nluwv_/cold-pi-default-484f07e9/first/home/tmp/agentcfg-native-rztt6kcg/cases/delegate-control","execution":{"exit_code":0,"termination_confirmed":true},"facts":{"activity_drained":true,"cancel_after_request_verified":true,"fresh_resume_verified":true,"probe_metadata_only":true,"real_account_used":false,"source_preserved":true,"standalone_delegate_sdk":true,"transport":"direct","user_cli_operations":["cancel","poll","probe","result","resume","start","status","wait"],"verified_results":2},"scenario_id":"delegate-control","status":"passed"},{"artifact_directory":"/tmp/agentcfg-pi-volume-o7nluwv_/cold-pi-default-484f07e9/first/home/tmp/agentcfg-native-rztt6kcg/cases/delegate-batch","execution":{"exit_code":0,"termination_confirmed":true},"facts":{"activity_drained":true,"batch_idempotency_verified":true,"batch_results":3,"manager_limit":2,"peak_manager_running":2,"real_account_used":false,"roles":["reviewer","scout"],"sdk_session":true,"source_preserved":true,"tools":["Agent","bash","edit","editor","find","get_subagent_result","grep","ls","model_delegate","read","rename","steer_subagent","todo","write"],"transport":"direct","user_cli_verified":true},"scenario_id":"delegate-batch","status":"passed"},{"artifact_directory":"/tmp/agentcfg-pi-volume-o7nluwv_/cold-pi-default-484f07e9/first/home/tmp/agentcfg-native-rztt6kcg/cases/delegate-proxy-control","execution":{"exit_code":0,"termination_confirmed":true},"facts":{"activity_drained":true,"cancel_after_request_verified":true,"fresh_resume_verified":true,"probe_metadata_only":true,"proxy_authentication_verified":true,"real_account_used":false,"source_preserved":true,"standalone_delegate_sdk":true,"transport":"proxy","user_cli_operations":["cancel","poll","probe","result","resume","start","status","wait"],"verified_results":2},"scenario_id":"delegate-proxy-control","status":"passed"}],"runtime":{"engine":"node","lock_identity":"484f07e9f16e070296b88ba24dcf7a5900f9d098ed1d5f43340c4f31b281dd26","platform":"linux-x86_64","profile":"pi-default","runtime_identity":"9ee94e7bb1c96499c2448859b102c61639b1ba855587ee2738f1c5a600e3524e","slice_identity":"aacdc54b23898130f5d45b9fdda47de3054f62882477f0486cd6b5da3aafa5f2","toolchains":{"bun":"1.4.0","node":"v24.14.0","npm":"11.19.1"}},"schema_version":1,"source_digest":"2294e30ff067d5e577dddaba12a1ff3c4f4a6e878a597ca065feb82489ad0ba1","started_at":"2026-09-20T02:02:09.769201Z","status":"passed","tier":"native","work_root":"/tmp/agentcfg-pi-volume-o7nluwv_/cold-pi-default-484f07e9/first/home/tmp/agentcfg-native-rztt6kcg"}
