{"case":"model-delegate-replacement","finished_at":"2026-09-21T04:47:29.020547Z","limitations":["synthetic-loopback-models; no real accounts"],"results":[{"artifact_directory":"/home/weixiaoxian.wxx/.cache/agentcfg-pi-handoff/run.9EvW7wDS/pi-codex/第二组 空格路径/home/tmp/agentcfg-native-gx0ofq90/cases/delegate-presets","execution":{"exit_code":0,"termination_confirmed":true},"facts":{"activity_drained":true,"delegate_runs":7,"manager_limit":2,"presets_verified":["general","context","challenge","plan","research","review","scout"],"real_account_used":false,"roles":["reviewer","scout"],"sdk_session":true,"source_preserved":true,"tools":["Agent","bash","edit","editor","find","get_subagent_result","grep","ls","model_delegate","read","rename","steer_subagent","todo","write"],"transport":"direct","verified_execution_only":true},"scenario_id":"delegate-presets","status":"passed"},{"artifact_directory":"/home/weixiaoxian.wxx/.cache/agentcfg-pi-handoff/run.9EvW7wDS/pi-codex/第二组 空格路径/home/tmp/agentcfg-native-gx0ofq90/cases/delegate-control","execution":{"exit_code":0,"termination_confirmed":true},"facts":{"activity_drained":true,"cancel_after_request_verified":true,"fresh_resume_verified":true,"probe_metadata_only":true,"real_account_used":false,"source_preserved":true,"standalone_delegate_sdk":true,"transport":"direct","user_cli_operations":["cancel","poll","probe","result","resume","start","status","wait"],"verified_results":2},"scenario_id":"delegate-control","status":"passed"},{"artifact_directory":"/home/weixiaoxian.wxx/.cache/agentcfg-pi-handoff/run.9EvW7wDS/pi-codex/第二组 空格路径/home/tmp/agentcfg-native-gx0ofq90/cases/delegate-batch","execution":{"exit_code":0,"termination_confirmed":true},"facts":{"activity_drained":true,"batch_idempotency_verified":true,"batch_results":3,"manager_limit":2,"peak_manager_running":2,"real_account_used":false,"roles":["reviewer","scout"],"sdk_session":true,"source_preserved":true,"tools":["Agent","bash","edit","editor","find","get_subagent_result","grep","ls","model_delegate","read","rename","steer_subagent","todo","write"],"transport":"direct","user_cli_verified":true},"scenario_id":"delegate-batch","status":"passed"}],"runtime":{"engine":"node","lock_identity":"4c043f8fa2f52cc7b198a030c51f814ba937c405da100331ed75bd8a73993424","platform":"linux-x86_64","profile":"pi-codex","runtime_identity":"d519b743818eca85220ef7d52c0e6a2611c588e9bc788ead422571e54d3511e9","slice_identity":"a98b00ef155ccfa2124406b0a790c0363cdb93a81dd89f175122ccc4c2f878e8","toolchains":{"bun":"1.4.0","node":"v24.14.0","npm":"11.19.1"}},"schema_version":1,"source_digest":"615713e72cd2803b907957f7e568bb3b0ef567b4ff88f337e8c5919e3b2e1938","started_at":"2026-09-21T04:40:47.351979Z","status":"passed","tier":"native","work_root":"/home/weixiaoxian.wxx/.cache/agentcfg-pi-handoff/run.9EvW7wDS/pi-codex/第二组 空格路径/home/tmp/agentcfg-native-gx0ofq90"}
