{"case":"optional-services","finished_at":"2026-09-19T20:10:33.890622Z","limitations":["synthetic-loopback-models; no real accounts"],"results":[{"artifact_directory":"/tmp/agentcfg-pi-volume-o7nluwv_/tmp/agentcfg-native-qshkiqea/cases/mcp-service","execution":{"exit_code":0,"termination_confirmed":true},"facts":{"capability":"mcp","mcp_servers_verified":1,"metadata_refreshed":true,"real_account_used":false,"sdk_session":true,"service_request_observed":true,"source_preserved":true},"scenario_id":"mcp-service","status":"passed"},{"artifact_directory":"/tmp/agentcfg-pi-volume-o7nluwv_/tmp/agentcfg-native-qshkiqea/cases/web-service","execution":{"exit_code":0,"termination_confirmed":true},"facts":{"capability":"web","real_account_used":false,"sdk_session":true,"search_response_verified":true,"service_request_observed":true,"source_preserved":true,"web_providers_verified":1},"scenario_id":"web-service","status":"passed"},{"artifact_directory":"/tmp/agentcfg-pi-volume-o7nluwv_/tmp/agentcfg-native-qshkiqea/cases/terminal-service","execution":{"exit_code":0,"termination_confirmed":true},"facts":{"capability":"terminal","real_account_used":false,"sdk_session":true,"service_request_observed":true,"source_preserved":true,"terminal_reports_acknowledged":3},"scenario_id":"terminal-service","status":"passed"}],"runtime":{"engine":"node","lock_identity":"f815508da8e97b61a56d84a224bb8fc20c74193e8fb957f618795b1c8730139f","platform":"linux-x86_64","profile":"pi-default","runtime_identity":"3d8b9756d111bfad591a7c41d784a16edd0c9799a88de4aa9b69608db44a0027","slice_identity":"38142848aaf82d0951928373f3fec70b838cf07b4d54c421f842937679bdf70a","toolchains":{"bun":"1.4.0","node":"v24.14.0","npm":"11.19.1"}},"schema_version":1,"source_digest":"7fa8a17f04de776491cea7d470ba49864d9c1c95efdbce76ec645862c987081e","started_at":"2026-09-19T20:08:54.740864Z","status":"passed","tier":"native","work_root":"/tmp/agentcfg-pi-volume-o7nluwv_/tmp/agentcfg-native-qshkiqea"}
