{"case":"budget-permissions","finished_at":"2026-09-20T01:08:21.060233Z","limitations":["synthetic-loopback-models; no real accounts"],"results":[{"artifact_directory":"/tmp/agentcfg-pi-volume-o7nluwv_/cold-pi-default-fdfdc714/first/home/tmp/agentcfg-native-okziuw87/cases/permission-denials","execution":{"exit_code":0,"termination_confirmed":true},"facts":{"guarded_denial":true,"manager_limit":2,"model_roundtrip":true,"no_file_admission":true,"real_account_used":false,"roles":["reviewer","scout"],"sdk_session":true,"source_preserved":true,"tools":["Agent","bash","edit","editor","find","get_subagent_result","grep","ls","model_delegate","read","rename","steer_subagent","todo","write"],"transport":"direct"},"scenario_id":"permission-denials","status":"passed"}],"runtime":{"engine":"node","lock_identity":"fdfdc71436abeedc27a8fdab707052b4f384d1536a925648629e02783fdbb976","platform":"linux-x86_64","profile":"pi-default","runtime_identity":"13d410dbb1f329533816dbcecd778d0d8c2dbc378050101d65809d6bb1ec5007","slice_identity":"f4b4219391a4f1b38ea9027b1894f1eae2929c70b42b8c75fb4b67a77dbab7a9","toolchains":{"bun":"1.4.0","node":"v24.14.0","npm":"11.19.1"}},"schema_version":1,"source_digest":"1fce14cfb3935d91045c0f88d488a3b7ea76c58b1029b6c5ec9309aaed15f457","started_at":"2026-09-20T01:07:32.416970Z","status":"passed","tier":"native","work_root":"/tmp/agentcfg-pi-volume-o7nluwv_/cold-pi-default-fdfdc714/first/home/tmp/agentcfg-native-okziuw87"}
