{"case":"migration-conflicts","finished_at":"2026-09-20T02:01:40.847876Z","limitations":["synthetic-loopback-models; no real accounts"],"results":[{"artifact_directory":"/tmp/agentcfg-pi-volume-o7nluwv_/cold-pi-default-484f07e9/first/home/tmp/agentcfg-native-lw6k7gh9/cases/migration-runtime-conflicts","execution":{"exit_code":0,"termination_confirmed":true},"facts":{"active_mutations_rejected":true,"apply_idempotent":true,"credentials_not_imported":true,"guarded_read":true,"legacy_marker_detected":true,"manager_limit":2,"model_roundtrip":true,"old_home_preserved":true,"real_account_used":false,"roles":["reviewer","scout"],"sdk_session":true,"source_preserved":true,"tools":["Agent","bash","edit","editor","find","get_subagent_result","grep","ls","model_delegate","read","rename","steer_subagent","todo","write"],"transport":"direct","unowned_file_preserved":true},"scenario_id":"migration-runtime-conflicts","status":"passed"}],"runtime":{"engine":"node","lock_identity":"484f07e9f16e070296b88ba24dcf7a5900f9d098ed1d5f43340c4f31b281dd26","platform":"linux-x86_64","profile":"pi-default","runtime_identity":"9ee94e7bb1c96499c2448859b102c61639b1ba855587ee2738f1c5a600e3524e","slice_identity":"aacdc54b23898130f5d45b9fdda47de3054f62882477f0486cd6b5da3aafa5f2","toolchains":{"bun":"1.4.0","node":"v24.14.0","npm":"11.19.1"}},"schema_version":1,"source_digest":"2294e30ff067d5e577dddaba12a1ff3c4f4a6e878a597ca065feb82489ad0ba1","started_at":"2026-09-20T02:00:17.816012Z","status":"passed","tier":"native","work_root":"/tmp/agentcfg-pi-volume-o7nluwv_/cold-pi-default-484f07e9/first/home/tmp/agentcfg-native-lw6k7gh9"}
