{"case":"migration-conflicts","finished_at":"2026-09-21T16:58:06.103581Z","limitations":["synthetic-loopback-models; no real accounts"],"results":[{"artifact_directory":"/home/weixiaoxian.wxx/.cache/agentcfg-pi-handoff/run2.mSLsYCX7/pi-default/第二组 空格路径/home/tmp/agentcfg-native-zdrz7n95/cases/migration-runtime-conflicts","execution":{"exit_code":0,"termination_confirmed":true},"facts":{"active_mutations_rejected":true,"apply_idempotent":true,"credentials_not_imported":true,"guarded_read":true,"legacy_marker_detected":true,"manager_limit":2,"model_roundtrip":true,"old_home_preserved":true,"real_account_used":false,"roles":["reviewer","scout"],"sdk_session":true,"source_preserved":true,"tools":["Agent","bash","edit","editor","find","get_subagent_result","grep","ls","model_delegate","read","rename","steer_subagent","todo","write"],"transport":"direct","unowned_file_preserved":true},"scenario_id":"migration-runtime-conflicts","status":"passed"}],"runtime":{"engine":"node","lock_identity":"32da47998e8388a84f291d217b39f105b294dd1f9676831c5e56a2709a8d28ca","platform":"linux-x86_64","profile":"pi-default","runtime_identity":"06342bbf9238f49e7fab7761b9df3fdffcfeec49bd589aa582fe50802f3d4af2","slice_identity":"248acc52e70b4aaa744137960d8057e0a8534f6335b524af6d6da84d4244f629","toolchains":{"bun":"1.4.0","node":"v24.14.0","npm":"11.19.1"}},"schema_version":1,"source_digest":"f636308f0af290f8d4fd2ea9fdb3234624918b5b67d8fae7538a8e8dc1090af2","started_at":"2026-09-21T16:56:32.349949Z","status":"passed","tier":"native","work_root":"/home/weixiaoxian.wxx/.cache/agentcfg-pi-handoff/run2.mSLsYCX7/pi-default/第二组 空格路径/home/tmp/agentcfg-native-zdrz7n95"}
