{"case":"host-resources","finished_at":"2026-09-21T03:35:54.601279Z","limitations":["synthetic-loopback-models; no real accounts"],"results":[{"artifact_directory":"/home/weixiaoxian.wxx/.cache/agentcfg-pi-handoff/run.9EvW7wDS/pi-default/first/home/tmp/agentcfg-native-220_6hgq/cases/host-resources","execution":{"exit_code":0,"termination_confirmed":true},"facts":{"guarded_read":true,"manager_limit":2,"model_roundtrip":true,"real_account_used":false,"roles":["reviewer","scout"],"sdk_session":true,"source_preserved":true,"todo_roundtrip":true,"tools":["Agent","bash","edit","editor","find","get_subagent_result","grep","ls","model_delegate","read","rename","steer_subagent","todo","write"],"transport":"direct"},"scenario_id":"host-resources","status":"passed"}],"runtime":{"engine":"node","lock_identity":"4c043f8fa2f52cc7b198a030c51f814ba937c405da100331ed75bd8a73993424","platform":"linux-x86_64","profile":"pi-default","runtime_identity":"00e8a5c71be50756d7149fba51773e978518cf189a742ab60f5f3835cb30d2d4","slice_identity":"aacdc54b23898130f5d45b9fdda47de3054f62882477f0486cd6b5da3aafa5f2","toolchains":{"bun":"1.4.0","node":"v24.14.0","npm":"11.19.1"}},"schema_version":1,"source_digest":"615713e72cd2803b907957f7e568bb3b0ef567b4ff88f337e8c5919e3b2e1938","started_at":"2026-09-21T03:35:09.853427Z","status":"passed","tier":"native","work_root":"/home/weixiaoxian.wxx/.cache/agentcfg-pi-handoff/run.9EvW7wDS/pi-default/first/home/tmp/agentcfg-native-220_6hgq"}
