{"case":"budget-permissions","finished_at":"2026-09-20T01:04:02.326453Z","limitations":["synthetic-loopback-models; no real accounts"],"results":[{"artifact_directory":"/tmp/agentcfg-pi-volume-o7nluwv_/cold-pi-cursor-fdfdc714/first/home/tmp/agentcfg-native-zxkbl8d4/cases/permission-denials","execution":{"exit_code":0,"termination_confirmed":true},"facts":{"guarded_denial":true,"manager_limit":2,"model_roundtrip":true,"no_file_admission":true,"real_account_used":false,"roles":["reviewer","scout"],"sdk_session":true,"source_preserved":true,"tools":["Agent","bash","edit","editor","find","get_subagent_result","grep","ls","model_delegate","read","rename","steer_subagent","todo","write"],"transport":"direct"},"scenario_id":"permission-denials","status":"passed"}],"runtime":{"engine":"bun","lock_identity":"fdfdc71436abeedc27a8fdab707052b4f384d1536a925648629e02783fdbb976","platform":"linux-x86_64","profile":"pi-cursor","runtime_identity":"e57e5e8428bb3d2c07cb2b0f1a7ab3e90c51d06fb8e326dcdfb73c940726252b","slice_identity":"de1e4271aba312bf11687c91b7b35ea69bcc8ce1849d2539bc2ae3a14996418a","toolchains":{"bun":"1.4.0","node":"v24.14.0","npm":"11.19.1"}},"schema_version":1,"source_digest":"1fce14cfb3935d91045c0f88d488a3b7ea76c58b1029b6c5ec9309aaed15f457","started_at":"2026-09-20T01:03:19.166960Z","status":"passed","tier":"native","work_root":"/tmp/agentcfg-pi-volume-o7nluwv_/cold-pi-cursor-fdfdc714/first/home/tmp/agentcfg-native-zxkbl8d4"}
