{"case":"termination-recovery","command":["/tmp/pi-cold-9d6a9270/pi-codex/first/checkout/.venv/bin/python","/tmp/pi-cold-9d6a9270/pi-codex/first/checkout/scripts/verify-pi.py","--tier","native","--allow-host","--case","termination-recovery","--runtime","/tmp/pi-cold-9d6a9270/pi-codex/first/home/native-fixture/instances_root/pi/pi-codex/runtimes/4b031247290b8e80fbbd0306d44043faf43a611ec03650a3d83d6b6458eb2a01","--output","/tmp/pi-cold-9d6a9270/pi-codex/first/native/termination-recovery.json"],"finished_at":"2026-09-23T10:52:53.303101Z","limitations":["synthetic-loopback-models; no real accounts"],"results":[{"artifact_directory":"/tmp/pi-cold-9d6a9270/pi-codex/first/home/tmp/agentcfg-native-u2dy7kv6/cases/parent-loss","execution":{"exit_code":0,"termination_confirmed":true},"facts":{"activity_drained":true,"child_execution_kind":"external","manager_limit":2,"parent_exit_observed":true,"real_account_used":false,"roles":["reviewer","scout"],"sdk_session":true,"source_preserved":true,"tools":["Agent","bash","edit","editor","find","get_subagent_result","grep","ls","model_delegate","read","rename","steer_subagent","todo","write"],"transport":"direct","worker_revocation_observed":true},"scenario_id":"parent-loss","status":"passed"},{"artifact_directory":"/tmp/pi-cold-9d6a9270/pi-codex/first/home/tmp/agentcfg-native-u2dy7kv6/cases/recovery-grants","execution":{"exit_code":0,"termination_confirmed":true},"facts":{"first_party_processes":true,"live_owner_rejected":true,"old_owner_dead":true,"real_account_used":false,"sdk_session":false,"source_preserved":true,"stop_only_recovery":true,"target_terminated":true,"wrong_plan_rejected":true},"scenario_id":"recovery-grants","status":"passed"},{"artifact_directory":"/tmp/pi-cold-9d6a9270/pi-codex/first/home/tmp/agentcfg-native-u2dy7kv6/cases/ordinary-cancel","execution":{"exit_code":0,"termination_confirmed":true},"facts":{"activity_drained":true,"cancel_after_request_verified":true,"manager_limit":2,"manager_stopped":true,"ordinary_session_started":true,"real_account_used":false,"roles":["reviewer","scout"],"sdk_session":true,"sdk_stream_settled":true,"source_preserved":true,"tools":["Agent","bash","edit","editor","find","get_subagent_result","grep","ls","model_delegate","read","rename","steer_subagent","todo","write"],"transport":"direct"},"scenario_id":"ordinary-cancel","status":"passed"}],"runtime":{"engine":"node","lock_identity":"9d6a927093f066c9428a5c193a636c4d73c5e64c946d24dc6a08185cf3f0dbf0","platform":"linux-x86_64","profile":"pi-codex","runtime_identity":"4b031247290b8e80fbbd0306d44043faf43a611ec03650a3d83d6b6458eb2a01","slice_identity":"2b6bdeec870ef9fa5ea8bfdbc6577b8a86044d181b717d90b646ceb462b7ecde","toolchains":{"bun":"1.4.0","node":"v24.14.0","npm":"11.19.1"}},"schema_version":1,"source_digest":"8b6c81207aab0b370bac3e14c880bbf0d39e3799645f063d2155cfa9c5ca128f","started_at":"2026-09-23T10:50:41.315083Z","status":"passed","tier":"native","work_root":"/tmp/pi-cold-9d6a9270/pi-codex/first/home/tmp/agentcfg-native-u2dy7kv6"}
