{"case":"termination-recovery","command":["/tmp/pi-cold-9d6a9270/pi-managed/第二组 空格路径/checkout/.venv/bin/python","/tmp/pi-cold-9d6a9270/pi-managed/第二组 空格路径/checkout/scripts/verify-pi.py","--tier","native","--allow-host","--case","termination-recovery","--runtime","/tmp/pi-cold-9d6a9270/pi-managed/第二组 空格路径/home/native-fixture/instances_root/pi/pi-managed/runtimes/c087a6e8def75187af936d7f293fb6fbe5e9218cb326b72c97e559ed8d5c5314","--output","/tmp/pi-cold-9d6a9270/pi-managed/第二组 空格路径/native/termination-recovery.json"],"finished_at":"2026-09-23T12:00:32.489000Z","limitations":["synthetic-loopback-models; no real accounts"],"results":[{"artifact_directory":"/tmp/pi-cold-9d6a9270/pi-managed/第二组 空格路径/home/tmp/agentcfg-native-oyhnqwt4/cases/parent-loss","execution":{"exit_code":0,"termination_confirmed":true},"facts":{"activity_drained":true,"manager_limit":2,"parent_exit_observed":true,"real_account_used":false,"roles":["task-keeper-reader","task-keeper-reviewer","task-keeper-writer"],"sdk_session":true,"source_preserved":true,"tools":["Agent","bash","edit","editor","find","get_subagent_result","grep","kernel_task","ls","read","rename","steer_subagent","write"],"transport":"direct","worker_revocation_observed":true},"scenario_id":"parent-loss","status":"passed"},{"artifact_directory":"/tmp/pi-cold-9d6a9270/pi-managed/第二组 空格路径/home/tmp/agentcfg-native-oyhnqwt4/cases/recovery-grants","execution":{"exit_code":0,"termination_confirmed":true},"facts":{"first_party_processes":true,"live_owner_rejected":true,"old_owner_dead":true,"real_account_used":false,"sdk_session":false,"source_preserved":true,"stop_only_recovery":true,"target_terminated":true,"wrong_plan_rejected":true},"scenario_id":"recovery-grants","status":"passed"},{"artifact_directory":"/tmp/pi-cold-9d6a9270/pi-managed/第二组 空格路径/home/tmp/agentcfg-native-oyhnqwt4/cases/taskkeeper-stop","execution":{"exit_code":0,"termination_confirmed":true},"facts":{"activity_drained":true,"manager_limit":2,"real_account_used":false,"roles":["task-keeper-reader","task-keeper-reviewer","task-keeper-writer"],"sdk_session":true,"stop_requested":true,"tools":["Agent","bash","edit","editor","find","get_subagent_result","grep","kernel_task","ls","read","rename","steer_subagent","write"],"transport":"direct","worker_started_before_control":true},"scenario_id":"taskkeeper-stop","status":"passed"}],"runtime":{"engine":"node","lock_identity":"9d6a927093f066c9428a5c193a636c4d73c5e64c946d24dc6a08185cf3f0dbf0","platform":"linux-x86_64","profile":"pi-managed","runtime_identity":"c087a6e8def75187af936d7f293fb6fbe5e9218cb326b72c97e559ed8d5c5314","slice_identity":"24ec993239496726d93fae2455bf24aa6683f6143915aa7e5fd3a818c58d1ed9","toolchains":{"bun":"1.4.0","node":"v24.14.0","npm":"11.19.1"}},"schema_version":1,"source_digest":"8b6c81207aab0b370bac3e14c880bbf0d39e3799645f063d2155cfa9c5ca128f","started_at":"2026-09-23T11:58:07.446121Z","status":"passed","tier":"native","work_root":"/tmp/pi-cold-9d6a9270/pi-managed/第二组 空格路径/home/tmp/agentcfg-native-oyhnqwt4"}
