{"case":"codex-receipts","finished_at":"2026-09-20T02:21:41.160632Z","limitations":["synthetic-loopback-models; no real accounts"],"results":[{"artifact_directory":"/tmp/agentcfg-pi-volume-o7nluwv_/cold-pi-codex-484f07e9/first/home/tmp/agentcfg-native-ibdonia6/cases/codex-native-readonly","execution":{"exit_code":0,"termination_confirmed":true},"facts":{"activity_drained":true,"candidate_result_verified":true,"kernel_namespace_verified":true,"native_tools_observed":true,"official_codex_cli":true,"privacy_denial_verified":true,"readonly_write_denied":true,"real_account_used":false,"sdk_session":false,"source_preserved":true,"transport":"direct","verified_execution":true,"write_mode":false},"scenario_id":"codex-native-readonly","status":"passed"},{"artifact_directory":"/tmp/agentcfg-pi-volume-o7nluwv_/cold-pi-codex-484f07e9/first/home/tmp/agentcfg-native-ibdonia6/cases/codex-native-write","execution":{"exit_code":0,"termination_confirmed":true},"facts":{"activity_drained":true,"candidate_result_verified":true,"kernel_namespace_verified":true,"native_tools_observed":true,"official_codex_cli":true,"privacy_denial_verified":true,"readonly_write_denied":false,"real_account_used":false,"sdk_session":false,"source_preserved":true,"transport":"direct","verified_execution":true,"write_mode":true},"scenario_id":"codex-native-write","status":"passed"},{"artifact_directory":"/tmp/agentcfg-pi-volume-o7nluwv_/cold-pi-codex-484f07e9/first/home/tmp/agentcfg-native-ibdonia6/cases/codex-native-control","execution":{"exit_code":0,"termination_confirmed":true},"facts":{"activity_drained":true,"cancel_after_request_verified":true,"fresh_resume_verified":true,"kernel_namespace_verified":true,"official_codex_cli":true,"probe_metadata_only":true,"real_account_used":false,"sdk_session":false,"source_preserved":true,"standalone_delegate_sdk":false,"transport":"direct","user_cli_operations":["cancel","poll","probe","result","resume","start","status","wait"],"verified_results":2},"scenario_id":"codex-native-control","status":"passed"}],"runtime":{"engine":"node","lock_identity":"484f07e9f16e070296b88ba24dcf7a5900f9d098ed1d5f43340c4f31b281dd26","platform":"linux-x86_64","profile":"pi-codex","runtime_identity":"505cf8da578ccbc3758e1155c63f592be5d1bed70e084da5e0e81eef47c4e7ef","slice_identity":"a98b00ef155ccfa2124406b0a790c0363cdb93a81dd89f175122ccc4c2f878e8","toolchains":{"bun":"1.4.0","node":"v24.14.0","npm":"11.19.1"}},"schema_version":1,"source_digest":"2294e30ff067d5e577dddaba12a1ff3c4f4a6e878a597ca065feb82489ad0ba1","started_at":"2026-09-20T02:14:06.320147Z","status":"passed","tier":"native","work_root":"/tmp/agentcfg-pi-volume-o7nluwv_/cold-pi-codex-484f07e9/first/home/tmp/agentcfg-native-ibdonia6"}
