{"case":"termination-recovery","finished_at":"2026-09-21T04:51:45.453946Z","limitations":["synthetic-loopback-models; no real accounts"],"results":[{"artifact_directory":"/home/weixiaoxian.wxx/.cache/agentcfg-pi-handoff/run.9EvW7wDS/pi-codex/第二组 空格路径/home/tmp/agentcfg-native-zqqcmnkj/cases/parent-loss","execution":{"exit_code":0,"termination_confirmed":true},"facts":{"activity_drained":true,"child_execution_kind":"external","manager_limit":2,"parent_exit_observed":true,"real_account_used":false,"roles":["reviewer","scout"],"sdk_session":true,"source_preserved":true,"tools":["Agent","bash","edit","editor","find","get_subagent_result","grep","ls","model_delegate","read","rename","steer_subagent","todo","write"],"transport":"direct","worker_revocation_observed":true},"scenario_id":"parent-loss","status":"passed"},{"artifact_directory":"/home/weixiaoxian.wxx/.cache/agentcfg-pi-handoff/run.9EvW7wDS/pi-codex/第二组 空格路径/home/tmp/agentcfg-native-zqqcmnkj/cases/recovery-grants","execution":{"exit_code":0,"termination_confirmed":true},"facts":{"first_party_processes":true,"live_owner_rejected":true,"old_owner_dead":true,"real_account_used":false,"sdk_session":false,"source_preserved":true,"stop_only_recovery":true,"target_terminated":true,"wrong_plan_rejected":true},"scenario_id":"recovery-grants","status":"passed"},{"artifact_directory":"/home/weixiaoxian.wxx/.cache/agentcfg-pi-handoff/run.9EvW7wDS/pi-codex/第二组 空格路径/home/tmp/agentcfg-native-zqqcmnkj/cases/ordinary-cancel","execution":{"exit_code":0,"termination_confirmed":true},"facts":{"activity_drained":true,"cancel_after_request_verified":true,"manager_limit":2,"manager_stopped":true,"ordinary_session_started":true,"real_account_used":false,"roles":["reviewer","scout"],"sdk_session":true,"sdk_stream_settled":true,"source_preserved":true,"tools":["Agent","bash","edit","editor","find","get_subagent_result","grep","ls","model_delegate","read","rename","steer_subagent","todo","write"],"transport":"direct"},"scenario_id":"ordinary-cancel","status":"passed"}],"runtime":{"engine":"node","lock_identity":"4c043f8fa2f52cc7b198a030c51f814ba937c405da100331ed75bd8a73993424","platform":"linux-x86_64","profile":"pi-codex","runtime_identity":"d519b743818eca85220ef7d52c0e6a2611c588e9bc788ead422571e54d3511e9","slice_identity":"a98b00ef155ccfa2124406b0a790c0363cdb93a81dd89f175122ccc4c2f878e8","toolchains":{"bun":"1.4.0","node":"v24.14.0","npm":"11.19.1"}},"schema_version":1,"source_digest":"615713e72cd2803b907957f7e568bb3b0ef567b4ff88f337e8c5919e3b2e1938","started_at":"2026-09-21T04:49:33.834484Z","status":"passed","tier":"native","work_root":"/home/weixiaoxian.wxx/.cache/agentcfg-pi-handoff/run.9EvW7wDS/pi-codex/第二组 空格路径/home/tmp/agentcfg-native-zqqcmnkj"}
