{"case":"budget-permissions","finished_at":"2026-09-21T04:22:11.106190Z","limitations":["synthetic-loopback-models; no real accounts"],"results":[{"artifact_directory":"/home/weixiaoxian.wxx/.cache/agentcfg-pi-handoff/run.9EvW7wDS/pi-codex/first/home/tmp/agentcfg-native-gf6mgoaq/cases/permission-denials","execution":{"exit_code":0,"termination_confirmed":true},"facts":{"guarded_denial":true,"manager_limit":2,"model_roundtrip":true,"no_file_admission":true,"real_account_used":false,"roles":["reviewer","scout"],"sdk_session":true,"source_preserved":true,"tools":["Agent","bash","edit","editor","find","get_subagent_result","grep","ls","model_delegate","read","rename","steer_subagent","todo","write"],"transport":"direct"},"scenario_id":"permission-denials","status":"passed"}],"runtime":{"engine":"node","lock_identity":"4c043f8fa2f52cc7b198a030c51f814ba937c405da100331ed75bd8a73993424","platform":"linux-x86_64","profile":"pi-codex","runtime_identity":"d519b743818eca85220ef7d52c0e6a2611c588e9bc788ead422571e54d3511e9","slice_identity":"a98b00ef155ccfa2124406b0a790c0363cdb93a81dd89f175122ccc4c2f878e8","toolchains":{"bun":"1.4.0","node":"v24.14.0","npm":"11.19.1"}},"schema_version":1,"source_digest":"615713e72cd2803b907957f7e568bb3b0ef567b4ff88f337e8c5919e3b2e1938","started_at":"2026-09-21T04:21:24.263256Z","status":"passed","tier":"native","work_root":"/home/weixiaoxian.wxx/.cache/agentcfg-pi-handoff/run.9EvW7wDS/pi-codex/first/home/tmp/agentcfg-native-gf6mgoaq"}
