{"case":"budget-permissions","command":["/tmp/pi-cold-9d6a9270/pi-codex/first/checkout/.venv/bin/python","/tmp/pi-cold-9d6a9270/pi-codex/first/checkout/scripts/verify-pi.py","--tier","native","--allow-host","--case","budget-permissions","--runtime","/tmp/pi-cold-9d6a9270/pi-codex/first/home/native-fixture/instances_root/pi/pi-codex/runtimes/4b031247290b8e80fbbd0306d44043faf43a611ec03650a3d83d6b6458eb2a01","--output","/tmp/pi-cold-9d6a9270/pi-codex/first/native/budget-permissions.json"],"finished_at":"2026-09-23T10:50:08.781975Z","limitations":["synthetic-loopback-models; no real accounts"],"results":[{"artifact_directory":"/tmp/pi-cold-9d6a9270/pi-codex/first/home/tmp/agentcfg-native-kypr_5vv/cases/permission-denials","execution":{"exit_code":0,"termination_confirmed":true},"facts":{"guarded_denial":true,"manager_limit":2,"model_roundtrip":true,"no_file_admission":true,"real_account_used":false,"roles":["reviewer","scout"],"sdk_session":true,"source_preserved":true,"tools":["Agent","bash","edit","editor","find","get_subagent_result","grep","ls","model_delegate","read","rename","steer_subagent","todo","write"],"transport":"direct"},"scenario_id":"permission-denials","status":"passed"}],"runtime":{"engine":"node","lock_identity":"9d6a927093f066c9428a5c193a636c4d73c5e64c946d24dc6a08185cf3f0dbf0","platform":"linux-x86_64","profile":"pi-codex","runtime_identity":"4b031247290b8e80fbbd0306d44043faf43a611ec03650a3d83d6b6458eb2a01","slice_identity":"2b6bdeec870ef9fa5ea8bfdbc6577b8a86044d181b717d90b646ceb462b7ecde","toolchains":{"bun":"1.4.0","node":"v24.14.0","npm":"11.19.1"}},"schema_version":1,"source_digest":"8b6c81207aab0b370bac3e14c880bbf0d39e3799645f063d2155cfa9c5ca128f","started_at":"2026-09-23T10:49:21.479884Z","status":"passed","tier":"native","work_root":"/tmp/pi-cold-9d6a9270/pi-codex/first/home/tmp/agentcfg-native-kypr_5vv"}
