{"case":"optional-services","command":["/tmp/pi-cold-9d6a9270/pi-default/第二组 空格路径/checkout/.venv/bin/python","/tmp/pi-cold-9d6a9270/pi-default/第二组 空格路径/checkout/scripts/verify-pi.py","--tier","native","--allow-host","--case","optional-services","--runtime","/tmp/pi-cold-9d6a9270/pi-default/第二组 空格路径/home/native-fixture/instances_root/pi/pi-default/runtimes/7fb660c4ecc48168d29facddf7ba8efdc186d3142b478fd1062f0ff6f2e601ba","--output","/tmp/pi-cold-9d6a9270/pi-default/第二组 空格路径/native/optional-services.json"],"finished_at":"2026-09-23T11:30:13.357672Z","limitations":["synthetic-loopback-models; no real accounts"],"results":[{"artifact_directory":"/tmp/pi-cold-9d6a9270/pi-default/第二组 空格路径/home/tmp/agentcfg-native-1lhnpnbo/cases/mcp-service","execution":{"exit_code":0,"termination_confirmed":true},"facts":{"capability":"mcp","mcp_servers_verified":1,"metadata_refreshed":true,"real_account_used":false,"sdk_session":true,"service_request_observed":true,"source_preserved":true},"scenario_id":"mcp-service","status":"passed"},{"artifact_directory":"/tmp/pi-cold-9d6a9270/pi-default/第二组 空格路径/home/tmp/agentcfg-native-1lhnpnbo/cases/web-service","execution":{"exit_code":0,"termination_confirmed":true},"facts":{"capability":"web","real_account_used":false,"sdk_session":true,"search_response_verified":true,"service_request_observed":true,"source_preserved":true,"web_providers_verified":1},"scenario_id":"web-service","status":"passed"},{"artifact_directory":"/tmp/pi-cold-9d6a9270/pi-default/第二组 空格路径/home/tmp/agentcfg-native-1lhnpnbo/cases/terminal-service","execution":{"exit_code":0,"termination_confirmed":true},"facts":{"capability":"terminal","real_account_used":false,"sdk_session":true,"service_request_observed":true,"source_preserved":true,"terminal_reports_acknowledged":3},"scenario_id":"terminal-service","status":"passed"}],"runtime":{"engine":"node","lock_identity":"9d6a927093f066c9428a5c193a636c4d73c5e64c946d24dc6a08185cf3f0dbf0","platform":"linux-x86_64","profile":"pi-default","runtime_identity":"7fb660c4ecc48168d29facddf7ba8efdc186d3142b478fd1062f0ff6f2e601ba","slice_identity":"e57f1ae98a4451a678c1464b1299c72e335b0a80ce780df43fe0c17816bd9786","toolchains":{"bun":"1.4.0","node":"v24.14.0","npm":"11.19.1"}},"schema_version":1,"source_digest":"8b6c81207aab0b370bac3e14c880bbf0d39e3799645f063d2155cfa9c5ca128f","started_at":"2026-09-23T11:28:05.780980Z","status":"passed","tier":"native","work_root":"/tmp/pi-cold-9d6a9270/pi-default/第二组 空格路径/home/tmp/agentcfg-native-1lhnpnbo"}
