{"case":"budget-permissions","finished_at":"2026-09-20T02:14:13.194051Z","limitations":["synthetic-loopback-models; no real accounts"],"results":[{"artifact_directory":"/tmp/agentcfg-pi-volume-o7nluwv_/cold-pi-default-484f07e9/first/home/tmp/agentcfg-native-pxlms25f/cases/permission-denials","execution":{"exit_code":0,"termination_confirmed":true},"facts":{"guarded_denial":true,"manager_limit":2,"model_roundtrip":true,"no_file_admission":true,"real_account_used":false,"roles":["reviewer","scout"],"sdk_session":true,"source_preserved":true,"tools":["Agent","bash","edit","editor","find","get_subagent_result","grep","ls","model_delegate","read","rename","steer_subagent","todo","write"],"transport":"direct"},"scenario_id":"permission-denials","status":"passed"}],"runtime":{"engine":"node","lock_identity":"484f07e9f16e070296b88ba24dcf7a5900f9d098ed1d5f43340c4f31b281dd26","platform":"linux-x86_64","profile":"pi-default","runtime_identity":"9ee94e7bb1c96499c2448859b102c61639b1ba855587ee2738f1c5a600e3524e","slice_identity":"aacdc54b23898130f5d45b9fdda47de3054f62882477f0486cd6b5da3aafa5f2","toolchains":{"bun":"1.4.0","node":"v24.14.0","npm":"11.19.1"}},"schema_version":1,"source_digest":"2294e30ff067d5e577dddaba12a1ff3c4f4a6e878a597ca065feb82489ad0ba1","started_at":"2026-09-20T02:13:33.303157Z","status":"passed","tier":"native","work_root":"/tmp/agentcfg-pi-volume-o7nluwv_/cold-pi-default-484f07e9/first/home/tmp/agentcfg-native-pxlms25f"}
