{"case":"readseek-tools","command":["/tmp/pi-cold-9d6a9270/pi-default/first/checkout/.venv/bin/python","/tmp/pi-cold-9d6a9270/pi-default/first/checkout/scripts/verify-pi.py","--tier","native","--allow-host","--case","readseek-tools","--runtime","/tmp/pi-cold-9d6a9270/pi-default/first/home/native-fixture/instances_root/pi/pi-default/runtimes/7fb660c4ecc48168d29facddf7ba8efdc186d3142b478fd1062f0ff6f2e601ba","--output","/tmp/pi-cold-9d6a9270/pi-default/first/native/readseek-tools.json"],"finished_at":"2026-09-23T11:00:18.128690Z","limitations":["synthetic-loopback-models; no real accounts"],"results":[{"artifact_directory":"/tmp/pi-cold-9d6a9270/pi-default/first/home/tmp/agentcfg-native-iarwe7d5/cases/readseek-tools","execution":{"exit_code":0,"termination_confirmed":true},"facts":{"activity_drained":true,"def_verified":true,"denied_write_rejected":true,"edit_verified":true,"grep_verified":true,"manager_limit":2,"read_verified":true,"real_account_used":false,"refs_verified":true,"rename_verified":true,"roles":["reviewer","scout"],"sdk_session":true,"search_verified":true,"source_preserved":true,"tools":["Agent","bash","edit","editor","find","get_subagent_result","grep","ls","model_delegate","read","readSeek_def","readSeek_digest","readSeek_edit","readSeek_grep","readSeek_refs","readSeek_rename","readSeek_search","readSeek_view","readSeek_write","rename","steer_subagent","todo","write"],"transport":"direct","view_verified":true,"write_verified":true},"scenario_id":"readseek-tools","status":"passed"}],"runtime":{"engine":"node","lock_identity":"9d6a927093f066c9428a5c193a636c4d73c5e64c946d24dc6a08185cf3f0dbf0","platform":"linux-x86_64","profile":"pi-default","runtime_identity":"7fb660c4ecc48168d29facddf7ba8efdc186d3142b478fd1062f0ff6f2e601ba","slice_identity":"e57f1ae98a4451a678c1464b1299c72e335b0a80ce780df43fe0c17816bd9786","toolchains":{"bun":"1.4.0","node":"v24.14.0","npm":"11.19.1"}},"schema_version":1,"source_digest":"8b6c81207aab0b370bac3e14c880bbf0d39e3799645f063d2155cfa9c5ca128f","started_at":"2026-09-23T10:57:33.110366Z","status":"passed","tier":"native","work_root":"/tmp/pi-cold-9d6a9270/pi-default/first/home/tmp/agentcfg-native-iarwe7d5"}
