{"case":"host-resources","command":["/tmp/pi-cold-9d6a9270/pi-managed/first/checkout/.venv/bin/python","/tmp/pi-cold-9d6a9270/pi-managed/first/checkout/scripts/verify-pi.py","--tier","native","--allow-host","--case","host-resources","--runtime","/tmp/pi-cold-9d6a9270/pi-managed/first/home/native-fixture/instances_root/pi/pi-managed/runtimes/c087a6e8def75187af936d7f293fb6fbe5e9218cb326b72c97e559ed8d5c5314","--output","/tmp/pi-cold-9d6a9270/pi-managed/first/native/host-resources.json"],"finished_at":"2026-09-23T10:39:11.608242Z","limitations":["synthetic-loopback-models; no real accounts"],"results":[{"artifact_directory":"/tmp/pi-cold-9d6a9270/pi-managed/first/home/tmp/agentcfg-native-fhfllxia/cases/host-resources","execution":{"exit_code":0,"termination_confirmed":true},"facts":{"guarded_read":true,"manager_limit":2,"model_roundtrip":true,"real_account_used":false,"roles":["task-keeper-reader","task-keeper-reviewer","task-keeper-writer"],"sdk_session":true,"source_preserved":true,"tools":["Agent","bash","edit","editor","find","get_subagent_result","grep","kernel_task","ls","read","rename","steer_subagent","write"],"transport":"direct"},"scenario_id":"host-resources","status":"passed"}],"runtime":{"engine":"node","lock_identity":"9d6a927093f066c9428a5c193a636c4d73c5e64c946d24dc6a08185cf3f0dbf0","platform":"linux-x86_64","profile":"pi-managed","runtime_identity":"c087a6e8def75187af936d7f293fb6fbe5e9218cb326b72c97e559ed8d5c5314","slice_identity":"24ec993239496726d93fae2455bf24aa6683f6143915aa7e5fd3a818c58d1ed9","toolchains":{"bun":"1.4.0","node":"v24.14.0","npm":"11.19.1"}},"schema_version":1,"source_digest":"8b6c81207aab0b370bac3e14c880bbf0d39e3799645f063d2155cfa9c5ca128f","started_at":"2026-09-23T10:38:26.811021Z","status":"passed","tier":"native","work_root":"/tmp/pi-cold-9d6a9270/pi-managed/first/home/tmp/agentcfg-native-fhfllxia"}
