{"case":"termination-recovery","finished_at":"2026-09-20T01:22:33.982406Z","limitations":["synthetic-loopback-models; no real accounts"],"results":[{"artifact_directory":"/tmp/agentcfg-pi-volume-o7nluwv_/cold-pi-cursor-fdfdc714/第二组 空格路径/home/tmp/agentcfg-native-z9oqo4dw/cases/parent-loss","execution":{"exit_code":0,"termination_confirmed":true},"facts":{"activity_drained":true,"child_execution_kind":"external","manager_limit":2,"parent_exit_observed":true,"real_account_used":false,"roles":["reviewer","scout"],"sdk_session":true,"source_preserved":true,"tools":["Agent","bash","edit","editor","find","get_subagent_result","grep","ls","model_delegate","read","rename","steer_subagent","todo","write"],"transport":"direct","worker_revocation_observed":true},"scenario_id":"parent-loss","status":"passed"},{"artifact_directory":"/tmp/agentcfg-pi-volume-o7nluwv_/cold-pi-cursor-fdfdc714/第二组 空格路径/home/tmp/agentcfg-native-z9oqo4dw/cases/recovery-grants","execution":{"exit_code":0,"termination_confirmed":true},"facts":{"first_party_processes":true,"live_owner_rejected":true,"old_owner_dead":true,"real_account_used":false,"sdk_session":false,"source_preserved":true,"stop_only_recovery":true,"target_terminated":true,"wrong_plan_rejected":true},"scenario_id":"recovery-grants","status":"passed"},{"artifact_directory":"/tmp/agentcfg-pi-volume-o7nluwv_/cold-pi-cursor-fdfdc714/第二组 空格路径/home/tmp/agentcfg-native-z9oqo4dw/cases/ordinary-cancel","execution":{"exit_code":0,"termination_confirmed":true},"facts":{"activity_drained":true,"cancel_after_request_verified":true,"manager_limit":2,"manager_stopped":true,"ordinary_session_started":true,"real_account_used":false,"roles":["reviewer","scout"],"sdk_session":true,"sdk_stream_settled":true,"source_preserved":true,"tools":["Agent","bash","edit","editor","find","get_subagent_result","grep","ls","model_delegate","read","rename","steer_subagent","todo","write"],"transport":"direct"},"scenario_id":"ordinary-cancel","status":"passed"}],"runtime":{"engine":"bun","lock_identity":"fdfdc71436abeedc27a8fdab707052b4f384d1536a925648629e02783fdbb976","platform":"linux-x86_64","profile":"pi-cursor","runtime_identity":"e57e5e8428bb3d2c07cb2b0f1a7ab3e90c51d06fb8e326dcdfb73c940726252b","slice_identity":"de1e4271aba312bf11687c91b7b35ea69bcc8ce1849d2539bc2ae3a14996418a","toolchains":{"bun":"1.4.0","node":"v24.14.0","npm":"11.19.1"}},"schema_version":1,"source_digest":"1fce14cfb3935d91045c0f88d488a3b7ea76c58b1029b6c5ec9309aaed15f457","started_at":"2026-09-20T01:20:37.834983Z","status":"passed","tier":"native","work_root":"/tmp/agentcfg-pi-volume-o7nluwv_/cold-pi-cursor-fdfdc714/第二组 空格路径/home/tmp/agentcfg-native-z9oqo4dw"}
