{"case":"readseek-tools","command":["/tmp/pi-cold-9d6a9270/pi-codex/first/checkout/.venv/bin/python","/tmp/pi-cold-9d6a9270/pi-codex/first/checkout/scripts/verify-pi.py","--tier","native","--allow-host","--case","readseek-tools","--runtime","/tmp/pi-cold-9d6a9270/pi-codex/first/home/native-fixture/instances_root/pi/pi-codex/runtimes/4b031247290b8e80fbbd0306d44043faf43a611ec03650a3d83d6b6458eb2a01","--output","/tmp/pi-cold-9d6a9270/pi-codex/first/native/readseek-tools.json"],"finished_at":"2026-09-23T10:56:11.063658Z","limitations":["synthetic-loopback-models; no real accounts"],"results":[{"artifact_directory":"/tmp/pi-cold-9d6a9270/pi-codex/first/home/tmp/agentcfg-native-0j7vbikk/cases/readseek-tools","execution":{"exit_code":0,"termination_confirmed":true},"facts":{"activity_drained":true,"def_verified":true,"denied_write_rejected":true,"edit_verified":true,"grep_verified":true,"manager_limit":2,"read_verified":true,"real_account_used":false,"refs_verified":true,"rename_verified":true,"roles":["reviewer","scout"],"sdk_session":true,"search_verified":true,"source_preserved":true,"tools":["Agent","bash","edit","editor","find","get_subagent_result","grep","ls","model_delegate","read","readSeek_def","readSeek_digest","readSeek_edit","readSeek_grep","readSeek_refs","readSeek_rename","readSeek_search","readSeek_view","readSeek_write","rename","steer_subagent","todo","write"],"transport":"direct","view_verified":true,"write_verified":true},"scenario_id":"readseek-tools","status":"passed"}],"runtime":{"engine":"node","lock_identity":"9d6a927093f066c9428a5c193a636c4d73c5e64c946d24dc6a08185cf3f0dbf0","platform":"linux-x86_64","profile":"pi-codex","runtime_identity":"4b031247290b8e80fbbd0306d44043faf43a611ec03650a3d83d6b6458eb2a01","slice_identity":"2b6bdeec870ef9fa5ea8bfdbc6577b8a86044d181b717d90b646ceb462b7ecde","toolchains":{"bun":"1.4.0","node":"v24.14.0","npm":"11.19.1"}},"schema_version":1,"source_digest":"8b6c81207aab0b370bac3e14c880bbf0d39e3799645f063d2155cfa9c5ca128f","started_at":"2026-09-23T10:53:22.182189Z","status":"passed","tier":"native","work_root":"/tmp/pi-cold-9d6a9270/pi-codex/first/home/tmp/agentcfg-native-0j7vbikk"}
